{"case":{"conditionId":"condition-generation-context-small-001","conditionIdentitySha256":"f1789430840ea879b6dd5615509a5490ca15483d63b6d6d45d4bf6f3f95fa6eb","contextMode":"compact-small","contextTier":"small","heldOutEpochId":null,"id":"generation-small","interactionMode":"artifact-response-v0.1","lineageId":"lineage-generation-001","lineageIdentitySha256":"6867cdd950394cd2a7f0b03872c0f15ce4cbcecd3fc2707592cd2b0adec795ce","split":"public-test","taskClass":"generation","visibilityClass":"public-development-reference"},"cohort":{"attemptPolicyIdentitySha256":"c1e5eac2b329175d5ea2683444ace76dbba4348e1a546d9a1931bbd07257896e","contaminationLabel":"declared-contaminated","contentIdentitySha256":"fde631d98026965f5657b883ccce3283f2200ff5e269d4bf5b8cc04170b322e2","contextMode":"compact-small","hardwareClassId":null,"interactionMode":"artifact-response-v0.1","kind":"genesis/genesisbench-cohort-v0.1","languageProfileArtifactSha256":"6721ee191adc1afcedd48e0aecb93ae556ac7e650fb91b003db5d4d2aba2021e","protocolIdentitySha256":"b13eed3d1ebd2dfdc65645d6187a7342d79efdeb0527176a20f8c7273f7adf27","scaffoldIdentitySha256":"b3890127b23511d6ff50c9ae54abd3845cfac82653142e13b45dec529c47a25d","taskEpochId":null,"taskVisibilityClass":"public-development-reference","trackId":"open-agent","version":"0.1.0"},"contamination":{"claimedLabel":"declared-contaminated","evidenceCodes":["known-exposure/public-development-reference","known-exposure/public-reference"],"strongestSupportedLabel":"declared-contaminated"},"contentIdentitySha256":"2fb82620cbaabd80f6bf25404bc7fadb6856a73ba9039075809bc514676fd0e1","eligibility":{"decision":"unranked","rankingCohort":"genesisbench-cohort-v0.1/fde631d98026965f5657b883ccce3283f2200ff5e269d4bf5b8cc04170b322e2","reasonCodes":["model/conformance-fixture","score/not-independently-rescored","task/public-reference","track/training-provenance-incomplete","visibility/practice-only"]},"kind":"genesis/genesisbench-eligibility-v0.1","protocol":{"id":"GenesisBench-v0.1","identitySha256":"b13eed3d1ebd2dfdc65645d6187a7342d79efdeb0527176a20f8c7273f7adf27","version":"0.1.0"},"run":{"attempts":1,"id":"generation-small-local-fixture-001","identitySha256":"d236258ab5f98d4d5d05ebbf1e11d0220fd6419747062b78e2d3455b4ff991c0","modelId":"genesis-agent-fixture","modelRevision":"sha256:ea5ae5d06096510cc7eb945a16687f2dfce0e2f1edbc4001ab1c4c07b24be5dd","qualityScoreBasisPoints":10000},"snapshot":{"commitSha1":"861a28957f03fb32d359fb6309ca828e5ed281a0","manifestIdentitySha256":"1475632bbfefc77287e4e0de9482e21830b9389aec5c1480914ec2b59b7cf8c0","treeSha1":"e58c48aac51026af4895265fa7736ac167ab8ca4"},"validation":{"independentRescoreObserved":false,"independentRescoreRequired":true,"judgeModelUsed":false,"profileValid":true,"runRecordValid":true,"scoreRecordValid":true,"snapshotValid":true},"version":"0.1.0"}
